{
  "schemaVersion": "2.0.0",
  "jobId": "mm-calc",
  "lang": "ko-KR",
  "theme": { "id": "base", "accent": "blue" },
  "captions": { "enabled": true, "style": "phrase-bottom" },
  "tailFrames": 15,
  "scenes": [
    { "id": "hook", "type": "hook", "startPhrase": "s01-8964f159",
      "props": { "headline": "M/M 계산법", "sub": "아직도 헷갈리나요?" },
      "transition": { "id": "crossfade", "durationFrames": 12 } },
    { "id": "price", "type": "keyword", "startPhrase": "s02-d69a5ce4",
      "props": { "text": "1,200원", "note": "1인 1개월 단가", "emphasis": "accent" },
      "transition": { "id": "cut" } },
    { "id": "six", "type": "keyword", "startPhrase": "s03-52adde05",
      "props": { "text": "6 M/M", "note": "3명 × 2개월", "emphasis": "accent" },
      "transition": { "id": "crossfade", "durationFrames": 10 } },
    { "id": "easy", "type": "keyword", "startPhrase": "s04-4ca7574c",
      "props": { "text": "간단!", "emphasis": "plain" },
      "transition": { "id": "cut" } },
    { "id": "how", "type": "steps", "startPhrase": "s05-07ddb622",
      "props": { "title": "계산 순서",
                 "items": [ { "text": "투입 인원 확인", "atPhrase": "s05-07ddb622" },
                            { "text": "기간을 월로 환산", "atPhrase": "s06-c97413c9" } ] },
      "transition": { "id": "crossfade", "durationFrames": 12 } },
    { "id": "example", "type": "keyword", "startPhrase": "s07-f13d325f",
      "props": { "text": "10일 = 0.33개월", "note": "열흘을 월로 바꾸면", "emphasis": "accent" },
      "transition": { "id": "cut" } },
    { "id": "shorts", "type": "keyword", "startPhrase": "s08-35648202",
      "props": { "text": "쇼츠·릴스", "note": "모두 같은 방식", "emphasis": "plain" },
      "transition": { "id": "crossfade", "durationFrames": 12 } },
    { "id": "outro", "type": "hook", "startPhrase": "s09-abe0b323",
      "props": { "headline": "숫자가 커져도 원리는 같다", "sub": "저장해 두고 필요할 때 꺼내 보세요" } }
  ]
}
